text,font_size,bold,italic,x0,y0,x1,y1,page
Headquartered at the,9.162199974060059,1,0,427.34588623046875,22.381698608398438,519.0317993164062,33.733665466308594,0
National Institute of Environmental,9.162199974060059,1,0,427.34564208984375,34.97972106933594,574.9652709960938,46.331687927246094,0
Health Sciences NIH,9.162199974060059,1,0,427.34564208984375,47.57774353027344,508.2102966308594,58.929710388183594,0
-,9.162199974060059,1,0,508.2112121582031,46.43247985839844,511.16143798828125,57.784446716308594,0
HHS,9.162199974060059,1,0,511.16143798828125,47.57774353027344,528.7344970703125,58.929710388183594,0
Cellphone Radio Frequency Radiation Studies,20.0,1,0,36.0,87.80770874023438,437.3620300292969,112.58770751953125,0
Cellphones are used by 97% of American adults.,12.0,0,0,36.0,131.46241760253906,274.8564758300781,145.88641357421875,0
1,6.995999813079834,0,0,274.85650634765625,132.23019409179688,278.4454650878906,140.63937377929688,0
"Given the large number of users, any harmful",12.0,0,0,35.997314453125,144.96241760253906,262.88970947265625,159.38641357421875,0
effects associated with cellphone use could be a,12.0,0,0,35.997314453125,158.46241760253906,278.0589294433594,172.88641357421875,0
significant public health concern.,12.0,0,0,35.997314453125,171.96241760253906,204.0789337158203,186.38641357421875,0
Cellphones use radio frequency radiation (RFR),12.0,0,0,35.997314453125,192.20643615722656,271.6148986816406,206.63043212890625,0
to transmit signals. The U.S. Food and Drug,12.0,0,0,35.997314453125,205.70643615722656,251.47891235351562,220.13043212890625,0
Administration (FDA) nominated RFR for study,12.0,0,0,35.997314453125,219.20643615722656,271.6401062011719,233.63043212890625,0
"by the National Toxicology Program (NTP),",12.0,0,0,35.997314453125,232.70643615722656,250.61611938476562,247.13043212890625,0
due to widespread human exposure and limited,12.0,0,0,35.997314453125,246.20643615722656,278.2509765625,260.63043212890625,0
information about the potential health effects of,12.0,0,0,35.997314453125,259.7064208984375,279.8577880859375,274.13043212890625,0
long-term cellphone use.,12.0,0,0,35.997314453125,273.2064208984375,163.43612670898438,287.63043212890625,0
What did NTP study?,12.0,1,0,35.997314453125,297.0144348144531,144.14132690429688,311.8824462890625,0
NTP conducted toxicology studies in rats and mice,12.0,0,0,35.997314453125,313.2984313964844,291.28533935546875,327.7224426269531,0
"cancer risk, from exposure to RFR used in 2G and",12.0,0,0,35.99732971191406,340.2984313964844,280.3149719238281,354.7224426269531,0
3G cellphones. 2G and 3G networks were standard,12.0,0,0,35.99732971191406,353.7984313964844,289.34979248046875,368.2224426269531,0
when the studies were designed and are still used,12.0,0,0,35.99732971191406,367.2984313964844,286.4829406738281,381.7224426269531,0
for phone calls and texting.,12.0,0,0,35.99732971191406,380.7984313964844,171.60696411132812,395.2224426269531,0
"The NTP studies, completed in 2018, are the most",12.0,0,0,35.99732971191406,401.04241943359375,284.10577392578125,415.4664306640625,0
"comprehensive assessment, to date, of health",12.0,0,0,35.99732971191406,414.54241943359375,265.4709167480469,428.9664306640625,0
effects in animals exposed to RFR.,12.0,0,0,35.99732971191406,428.04241943359375,206.69493103027344,442.4664306640625,0
What did the studies find?,12.0,1,0,312.7413330078125,343.4424133300781,448.5333251953125,358.3104248046875,0
"2G and 3G cellphones, NTP found:",12.0,0,0,312.7413024902344,373.2264099121094,485.7465515136719,387.6504211425781,0
•,11.5,1,0,312.73919677734375,393.5364990234375,318.83428955078125,407.7850036621094,0
Clear evidence of an association with tumors in,12.0,1,0,318.73919677734375,393.0419921875,565.5431518554688,407.9100036621094,0
the hearts of male rats.,12.0,1,0,318.73919677734375,406.5419921875,440.4671936035156,421.4100036621094,0
The tumors were malignant,12.0,0,0,440.34716796875,406.9859924316406,577.6859130859375,421.4100036621094,0
schwannomas.,12.0,0,0,318.73919677734375,420.4859924316406,391.4232177734375,434.9100036621094,0
•,11.5,1,0,312.73919677734375,440.6965026855469,318.83428955078125,454.94500732421875,0
Some evidence of an association with tumors in,12.0,1,0,318.73919677734375,440.2019958496094,568.1712036132812,455.07000732421875,0
the brains of male rats.,12.0,1,0,318.73919677734375,453.7019958496094,439.8083801269531,468.57000732421875,0
The tumors were malignant,12.0,0,0,439.6883544921875,454.14599609375,577.027099609375,468.57000732421875,0
gliomas.,12.0,0,0,318.73919677734375,467.64599609375,359.731201171875,482.07000732421875,0
•,11.5,1,0,312.73919677734375,487.85650634765625,318.83428955078125,502.1050109863281,0
Some evidence of an association with tumors,12.0,1,0,318.73919677734375,487.36199951171875,555.7871704101562,502.2300109863281,0
in the adrenal glands of male rats.,12.0,1,0,318.73919677734375,500.8619689941406,497.1911315917969,515.72998046875,0
The tumors,12.0,0,0,497.07110595703125,501.30596923828125,555.4871826171875,515.72998046875,0
"were benign, malignant, or complex combined",12.0,0,0,318.73919677734375,514.8059692382812,549.714111328125,529.22998046875,0
pheochromocytoma.,12.0,0,0,318.73919677734375,528.3059692382812,421.939208984375,542.72998046875,0
"For female rats, and male and female mice, it was",12.0,0,0,312.73919677734375,548.4660034179688,552.703369140625,562.8900146484375,0
"unclear, also known as equivocal, whether cancers",12.0,0,0,312.73919677734375,561.9660034179688,559.4833374023438,576.3900146484375,0
to RFR.,12.0,0,0,312.73919677734375,588.9660034179688,346.29119873046875,603.3900146484375,0
of evidence that a substance may cause cancer:,12.0,0,0,312.73919677734375,622.7100219726562,542.9232788085938,637.134033203125,0
•,11.5,0,0,312.73919677734375,639.031982421875,318.3052978515625,652.85498046875,0
Clear evidence (highest),12.0,0,0,318.73919677734375,638.5559692382812,436.3152160644531,652.97998046875,0
•,11.5,0,0,312.73919677734375,652.531982421875,318.3052978515625,666.35498046875,0
Some evidence,12.0,0,0,318.73919677734375,652.0559692382812,393.7859802246094,666.47998046875,0
•,11.5,0,0,312.73919677734375,666.031982421875,318.3052978515625,679.85498046875,0
Equivocal evidence,12.0,0,0,318.73919677734375,665.5559692382812,412.8540344238281,679.97998046875,0
•,11.5,0,0,312.73919677734375,679.531982421875,318.3052978515625,693.35498046875,0
No evidence (lowest),12.0,0,0,318.73919677734375,679.0559692382812,420.97918701171875,693.47998046875,0
If you are concerned about potential health risks,13.0,0,0,47.08000183105469,474.0010070800781,291.7101135253906,489.6400146484375,0
"from RFR, the FDA suggests the following tips:",13.0,0,0,47.08000183105469,489.0030212402344,276.1127624511719,504.64202880859375,0
2,7.578999996185303,0,0,277.0187072753906,489.8382263183594,280.7475891113281,498.95574951171875,0
"• Use speaker mode, headset, headphones,",13.0,0,0,49.65629959106445,509.4064025878906,263.7974853515625,525.04541015625,0
or earbuds to place more distance,13.0,0,0,56.863494873046875,524.408447265625,227.26748657226562,540.0474243164062,0
between your head and the cellphone.,13.0,0,0,56.863494873046875,539.4104614257812,246.5322723388672,555.0494384765625,0
• Reduce the amount of time spent,13.0,0,0,49.65629959106445,559.8118286132812,226.40948486328125,575.4508056640625,0
using your cellphone.,13.0,0,0,56.863494873046875,574.8138427734375,163.2152099609375,590.4528198242188,0
• Consider texting,13.0,0,0,49.65629959106445,595.2171020507812,143.84649658203125,610.8560791015625,0
rather than,13.0,0,0,56.863502502441406,610.2191162109375,118.89950561523438,625.8580932617188,0
talking — but,13.0,0,0,56.86350631713867,625.2211303710938,131.82150268554688,640.860107421875,0
don’t text while,13.0,0,0,56.863502502441406,640.2230834960938,138.49050903320312,655.862060546875,0
you are driving.,13.0,0,0,56.86351013183594,655.22509765625,134.7725067138672,670.8640747070312,0
"PO Box 12233 • Research Triangle Park, NC 27709",9.0,0,0,35.164798736572266,727.2525024414062,245.789794921875,737.7465209960938,0
Phone: 919-541-3345 •,9.0,0,0,35.16279602050781,738.25048828125,132.59683227539062,748.7445068359375,0
https://ntp.niehs.nih.gov,9.0,0,0,132.64183044433594,738.04345703125,238.08587646484375,748.7804565429688,0
January 2024,9.0,0,0,35.16279602050781,756.25048828125,90.0177993774414,766.7445068359375,0
Printed on recycled paper,9.0,0,0,470.6441955566406,756.1727294921875,575.5751953125,766.666748046875,0
Do the rat and mouse findings apply to humans?,12.0,1,0,45.255001068115234,70.47600555419922,283.3086242675781,85.32000732421875,1
The findings in animals cannot be directly applied,12.0,0,0,45.255001068115234,87.2280044555664,277.87493896484375,101.66400146484375,1
to humans for two key reasons:,12.0,0,0,45.255001068115234,101.2320327758789,192.0029754638672,115.66802978515625,1
•,11.5,0,0,45.255001068115234,122.45046997070312,50.41859817504883,136.28497314453125,1
The exposure levels and durations were greater,12.0,0,0,51.255001068115234,121.9739761352539,270.9737854003906,136.40997314453125,1
than what people may receive from cellphones.,12.0,0,0,51.255001068115234,135.97799682617188,272.6165466308594,150.41400146484375,1
•,11.5,0,0,45.255001068115234,154.77059936523438,50.41859817504883,168.6051025390625,1
The rats and mice received RFR across their whole,12.0,0,0,51.255001068115234,154.29409790039062,281.9669494628906,168.7301025390625,1
"bodies, which is different from the more localized",12.0,0,0,51.255001068115234,168.29812622070312,280.08172607421875,182.734130859375,1
"exposures humans may receive, like from a",12.0,0,0,51.255001068115234,182.30215454101562,251.38858032226562,196.7381591796875,1
cellphone in their pocket or next to their head.,12.0,0,0,51.255001068115234,196.30618286132812,263.3177490234375,210.7421875,1
"However, the studies question the long-held",12.0,0,0,45.255001068115234,214.63015747070312,260.33099365234375,229.066162109375,1
assumption that RFR is of no concern as long as,12.0,0,0,45.255001068115234,228.63418579101562,278.6429748535156,243.0701904296875,1
the energy level is low and does not significantly,12.0,0,0,45.255001068115234,242.63821411132812,281.1510314941406,257.07421875,1
heat the tissues.,12.0,0,0,45.255001068115234,256.6422424316406,123.0989990234375,271.0782470703125,1
Did NTP find health effects other than cancer?,12.0,1,0,36.255001068115234,290.4919738769531,274.8498840332031,305.3599853515625,1
NTP found lower body weights among newborn,12.0,0,0,36.255001068115234,307.2760009765625,276.3630065917969,321.70001220703125,1
"rats and their mothers, especially when exposed to",12.0,0,0,36.25498962402344,321.2799987792969,285.927001953125,335.7040100097656,1
"high levels of RFR during pregnancy and lactation,",12.0,0,0,36.25498962402344,335.28399658203125,283.2365417480469,349.7080078125,1
yet these animals grew to normal size. They also,12.0,0,0,36.25498962402344,349.2879943847656,271.31097412109375,363.7120056152344,1
found that RFR exposure was associated with an,12.0,0,0,36.25498962402344,363.2919921875,272.9178466796875,377.71600341796875,1
"increase in DNA damage. DNA damage, if not",12.0,0,0,36.25498962402344,377.2959899902344,259.165771484375,391.7200012207031,1
and the hippocampus of male rats.,12.0,0,0,36.25498962402344,447.31597900390625,205.4658203125,461.739990234375,1
What factors contributed to the NTP conclusions?,12.0,1,0,36.25498962402344,471.1239929199219,292.6950378417969,485.99200439453125,1
In addition to seeing tumors in the male rats with,12.0,0,0,36.25498962402344,487.9119873046875,278.2577819824219,502.33599853515625,1
other changes in the hearts of exposed male and,12.0,0,0,36.25498962402344,515.9199829101562,276.6629943847656,530.343994140625,1
female rats that supported their conclusions.,12.0,0,0,36.25498962402344,529.9240112304688,256.05780029296875,544.3480224609375,1
The evidence for tumors in the brain and adrenal,12.0,0,0,313.26300048828125,61.70795822143555,553.0458374023438,76.1319580078125,1
glands was not as strong as what NTP scientists,12.0,0,0,313.26300048828125,75.71199035644531,545.4966430664062,90.135986328125,1
heavy cellphone use in some human studies.,12.0,0,0,313.26300048828125,117.72407531738281,531.2178955078125,132.1480712890625,1
3,6.995999813079834,0,0,531.096923828125,118.42378997802734,534.6858520507812,126.8329849243164,1
"Still, the effects observed in the animals were",12.0,0,0,313.26171875,138.4040069580078,534.672607421875,152.8280029296875,1
rats appear to be at greater risk for developing,12.0,0,0,313.26171875,166.4120635986328,540.94970703125,180.8360595703125,1
tumors compared to female rats.,12.0,0,0,313.26171875,180.4160919189453,471.94970703125,194.840087890625,1
How do the RFR levels used in the studies,12.0,1,0,313.26171875,203.72007751464844,529.8004760742188,218.58807373046875,1
compare to typical human exposures?,12.0,1,0,313.26171875,216.22410583496094,511.1044616699219,231.09210205078125,1
The lowest exposure level used in the studies was,12.0,0,0,313.26171875,233.01210021972656,556.4525756835938,247.43609619140625,1
equal to the maximum exposure to the local tissue,12.0,0,0,313.26171875,247.01612854003906,561.8873291015625,261.44012451171875,1
(cells) currently allowed for cellphone users.,12.0,0,0,313.26171875,261.0201416015625,530.2577514648438,275.44415283203125,1
use. The highest exposure level in the studies was,12.0,0,0,313.2617492675781,289.02813720703125,556.2018432617188,303.4521484375,1
four times higher than the maximum power level,12.0,0,0,313.2617492675781,303.0321350097656,554.8338012695312,317.4561462402344,1
permitted for local tissues.,12.0,0,0,313.2617492675781,317.0361328125,441.21771240234375,331.46014404296875,1
Why did NTP expose the animals’ whole bodies,12.0,1,0,36.255001068115234,61.21201705932617,284.4389953613281,76.08001708984375,2
to RFR?,12.0,1,0,36.25498962402344,74.20799255371094,75.12300109863281,89.07598876953125,2
Although many previous studies focused on exposure,12.0,0,0,36.255001068115234,91.19599914550781,295.2761535644531,105.6199951171875,2
they were considering health effects to the whole,12.0,0,0,36.255001068115234,119.58796691894531,279.8298034667969,134.011962890625,2
phones next to their head much of time.,12.0,0,0,36.255001068115234,147.9799346923828,232.2977752685547,162.4039306640625,2
What is the difference between electric and,12.0,1,0,36.255001068115234,171.78794860839844,253.29779052734375,186.65594482421875,2
magnetic fields and RFR?,12.0,1,0,36.255001068115234,184.78392028808594,163.6110076904297,199.65191650390625,2
"(EMF), which are the invisible waves of force that",12.0,0,0,36.255001068115234,215.57594299316406,274.0469970703125,229.99993896484375,2
of EMF are distinguished by their frequencies.,12.0,0,0,36.2550048828125,243.58399963378906,262.57501220703125,258.00799560546875,2
that was thought to be relatively harmless.,12.0,0,0,36.2550048828125,271.5920104980469,243.02462768554688,286.0160217285156,2
How were the studies conducted?,12.0,1,0,36.2550048828125,295.3999938964844,211.09384155273438,310.26800537109375,2
Rats and mice were exposed to RFR in special,12.0,0,0,36.2550048828125,312.18798828125,260.8230285644531,326.61199951171875,2
"chambers for up to two years, or most of their",12.0,0,0,36.2550048828125,326.1919860839844,262.7669982910156,340.6159973144531,2
cancers and noncancer health effects.,12.0,0,0,36.2550048828125,354.1999816894531,219.5070037841797,368.6239929199219,2
Exposure to RFR began in the womb for rats and,12.0,0,0,36.2550048828125,374.9479675292969,273.23101806640625,389.3719787597656,2
at 5-6 weeks old for mice. The RFR exposure was,12.0,0,0,36.2550048828125,388.95196533203125,271.77899169921875,403.3759765625,2
"intermittent, 10 minutes on and 10 minutes off,",12.0,0,0,36.2550048828125,402.9559631347656,268.393798828125,417.3799743652344,2
totaling about nine hours each day. The RFR levels,12.0,0,0,36.2550048828125,416.9599609375,281.84698486328125,431.38397216796875,2
ranged from 1.5 to 6 watts per kilogram of body,12.0,0,0,36.2550048828125,430.9639587402344,271.57501220703125,445.3879699707031,2
The chambers were shielded rooms with a,12.0,0,0,318.2430114746094,61.6999626159668,533.436767578125,76.12396240234375,2
"transmitting antenna that radiated RFR fields,",12.0,0,0,318.2430114746094,76.19593811035156,549.19287109375,90.61993408203125,2
plus rotating stirrers that generated a uniform,12.0,0,0,318.2430114746094,90.69190979003906,549.107666015625,105.11590576171875,2
field.,12.0,0,0,318.2430114746094,105.18788146972656,342.5310363769531,119.61187744140625,2
"4,5",6.995999813079834,0,0,342.5274963378906,105.92378997802734,351.1535949707031,114.3329849243164,2
Pilot studies established field strengths,12.0,0,0,351.1531982421875,105.15602111816406,550.8790283203125,119.58001708984375,2
that did not raise animal body temperatures,12.0,0,0,318.2371826171875,119.65199279785156,540.3910522460938,134.07598876953125,2
excessively.,12.0,0,0,318.2371826171875,134.14796447753906,375.3812561035156,148.57196044921875,2
6,6.995999813079834,0,0,375.3833923339844,134.92379760742188,378.97235107421875,143.33297729492188,2
The rats and mice were exposed to whole body,12.0,0,0,318.239990234375,155.40602111816406,558.1657104492188,169.83001708984375,2
"RFR at frequencies of 900 and 1,900 megahertz,",12.0,0,0,318.239990234375,169.90199279785156,557.2273559570312,184.32598876953125,2
"respectively, from two technologies: code division",12.0,0,0,318.239990234375,184.39796447753906,566.6749877929688,198.82196044921875,2
multiple access (CDMA) and global system for,12.0,0,0,318.239990234375,198.89393615722656,547.8937377929688,213.31793212890625,2
mobile communications (GSM).,12.0,0,0,318.239990234375,213.38990783691406,474.7549133300781,227.81390380859375,2
NTP and RFR experts from the National Institute,12.0,0,0,318.239990234375,234.6419219970703,553.0907592773438,249.06591796875,2
of Standards and Technology (NIST) and the IT’IS,12.0,0,0,318.239990234375,249.1378936767578,556.6680908203125,263.5618896484375,2
Foundation designed and built the chambers,12.0,0,0,318.239990234375,263.63385009765625,541.11376953125,278.057861328125,2
specifically for these studies.,12.0,0,0,318.239990234375,278.1298522949219,458.6748046875,292.5538635253906,2
took place.,9.0,0,0,36.255001068115234,758.02099609375,76.11599731445312,768.8389892578125,2
What is the difference between CDMA and GSM?,12.0,1,0,318.239990234375,306.43798828125,561.8987426757812,321.3059997558594,2
CDMA and GSM are two common ways of,12.0,0,0,318.239990234375,323.7179870605469,527.9749145507812,338.14202880859375,2
transmitting cellphone signals in the U.S. and,12.0,0,0,318.239990234375,338.2140197753906,545.6138305664062,352.6380310058594,2
Europe. There are substantial differences in,12.0,0,0,318.239990234375,352.71002197265625,534.1417236328125,367.134033203125,2
signal structure that may result in different RFR,12.0,0,0,318.239990234375,367.2060241699219,553.9898071289062,381.6300354003906,2
"exposures, so NTP wanted to expose the animals",12.0,0,0,318.239990234375,381.7020263671875,562.7389526367188,396.12603759765625,2
to both modulations.,12.0,0,0,318.239990234375,396.1980285644531,423.5389709472656,410.6220397949219,2
"How do the NTP studies relate to 4G, 5G, or Wi-Fi?",12.0,1,0,318.239990234375,424.5060119628906,562.7161865234375,439.3740234375,2
NTP studies of RFR used in 2G and 3G cellphones,12.0,0,0,318.239990234375,441.7860107421875,563.5645141601562,456.21002197265625,2
do not apply to 4G or 5G technologies. These newer,12.0,0,0,318.239990234375,456.2820129394531,572.4362182617188,470.7060241699219,2
technologies use different methods of signal,12.0,0,0,318.239990234375,470.77801513671875,542.86572265625,485.2020263671875,2
modulation than NTP used in the studies. The NTP,12.0,0,0,318.239990234375,485.2740173339844,569.61376953125,499.6980285644531,2
studies also did not investigate frequencies and,12.0,0,0,318.239990234375,499.77001953125,557.6258544921875,514.1940307617188,2
modulations used for Wi-Fi.,12.0,0,0,318.239990234375,514.2660522460938,454.0429382324219,528.6900634765625,2
Is the NTP work on cellphone RFR completed?,12.0,1,0,318.239990234375,542.5740356445312,565.0560913085938,557.4420166015625,2
Yes. NIEHS scientists conducted follow-up research,12.0,0,0,318.239990234375,559.85400390625,566.9016723632812,574.2780151367188,2
to better understand some of the findings seen,12.0,0,0,318.239990234375,574.3500366210938,550.4400634765625,588.7740478515625,2
in the earlier RFR rodent studies.,12.0,0,0,318.239990234375,588.8460083007812,474.9959716796875,603.27001953125,2
"7,8",6.995999813079834,0,0,474.8135070800781,589.6937866210938,483.2996520996094,598.10302734375,2
A novel small-scale RFR exposure system was,12.0,0,0,318.2401123046875,610.1759643554688,539.8670043945312,624.5999755859375,2
developed. The researchers tested the new,12.0,0,0,318.2401123046875,624.6719970703125,528.984130859375,639.0960083007812,2
exposure system using in vivo rodent studies.,12.0,0,0,318.2401123046875,639.1680297851562,541.5121459960938,653.592041015625,2
The research was technically challenging and more,12.0,0,0,318.2401123046875,660.4199829101562,568.8447265625,674.843994140625,2
resource-intensive than expected. No additional,12.0,0,0,318.2401123046875,674.916015625,554.8416748046875,689.3400268554688,2
RFR studies are planned.,12.0,0,0,318.2401123046875,689.4119873046875,437.05096435546875,703.8359985351562,2
Where can I go for more information?,14.0,1,0,56.296199798583984,68.42188262939453,277.83221435546875,85.76788330078125,3
National Toxicology Program,12.0,1,0,54.20940017700195,128.76036071777344,207.6053924560547,143.62835693359375,3
https://ntp.niehs.nih.gov/go/cellphone,12.0,0,0,54.20939636230469,143.20838928222656,244.3253936767578,157.63238525390625,3
National Cancer Institute,12.0,1,0,54.20939636230469,161.26841735839844,186.43739318847656,176.13641357421875,3
U.S. Food and Drug Administration,12.0,1,0,54.20939636230469,193.77647399902344,240.55738830566406,208.64447021484375,3
https://go.usa.gov/B5tx,12.0,0,0,54.20939636230469,208.22450256347656,168.83340454101562,222.64849853515625,3
Federal Communications Commission,12.0,1,0,54.20939636230469,226.28453063964844,255.49740600585938,241.15252685546875,3
The National Toxicology Program is an,12.0,0,0,67.12139892578125,285.9005432128906,254.8481903076172,300.3245544433594,3
interagency program headquartered at the,12.0,0,0,54.68939971923828,299.8999938964844,269.5843200683594,314.32855224609375,3
National Institute of,12.0,1,0,108.5443115234375,313.4599914550781,215.24830627441406,328.3280029296875,3
Environmental Health Sciences,12.0,1,0,80.63230895996094,327.4639892578125,238.7922821044922,342.3320007324219,3
that tests and evaluates chemicals,12.0,0,0,77.63860321044922,341.89599609375,246.51461791992188,356.32000732421875,3
in our environment.,12.0,0,0,111.89862060546875,355.8999938964844,210.0826416015625,370.3240051269531,3
"For more information on NTP,",12.0,0,0,88.33061981201172,378.90399169921875,235.95462036132812,393.3280029296875,3
go to,12.0,0,0,79.39060974121094,392.9079895019531,107.66261291503906,407.3320007324219,3
https://ntp.niehs.nih.gov,12.0,1,0,107.54261779785156,392.4639892578125,237.6946258544922,407.3320007324219,3
.,12.0,0,0,237.5746307373047,392.9079895019531,240.05862426757812,407.3320007324219,3
website at,13.0,0,0,59.975502014160156,452.6606140136719,113.7955093383789,468.29962158203125,3
https://ntp.niehs.nih.gov/go/cellphone,13.0,0,0,113.66551208496094,452.6606140136719,309.0945739746094,468.29962158203125,3
.,13.0,0,0,308.8085021972656,452.6606140136719,311.551513671875,468.29962158203125,3
1,5.829999923706055,0,0,36.880001068115234,503.6198425292969,39.870792388916016,510.62750244140625,3
https://pewinternet.org/fact-sheet/mobile,10.0,0,0,270.8124084472656,502.9800109863281,441.9914855957031,515.0,3
"[accessed February 6, 2023].",10.0,0,0,441.8714904785156,502.9800109863281,556.7905883789062,515.0,3
2,5.829999923706055,0,0,36.880001068115234,520.119873046875,39.870792388916016,527.1275634765625,3
Available:,10.0,0,0,41.872406005859375,531.47998046875,82.9424057006836,543.5,3
"[accessed February 6, 2023].",10.0,0,0,41.872406005859375,543.47998046875,154.7924041748047,555.5,3
3,5.829999923706055,0,0,36.880001068115234,560.6198120117188,39.870792388916016,567.6275024414062,3
IARC Monogr Eval Carcinog Risks Hum 102:1-481.,10.0,0,0,41.89239501953125,571.97998046875,240.31134033203125,584.0,3
4,5.829999923706055,0,0,36.880001068115234,589.1198120117188,39.870792388916016,596.1275024414062,3
2017.,10.0,0,0,562.5823974609375,588.47998046875,590.8323974609375,600.5,3
5,5.829999923706055,0,0,36.880001068115234,617.6198120117188,39.870792388916016,624.6275024414062,3
2017. Life-time dosimetric,10.0,0,0,450.15240478515625,616.97998046875,560.05126953125,629.0,3
IEEE T Electromagn C 59(6):1798-1808.,10.0,0,0,41.882415771484375,640.97998046875,194.90240478515625,653.0,3
6,5.829999923706055,0,0,36.880001068115234,658.1198120117188,39.870792388916016,665.1275024414062,3
McCormick DL.,10.0,0,0,41.880001068115234,669.47998046875,105.18900299072266,681.5,3
7,5.829999923706055,0,0,36.880001068115234,698.6198120117188,39.870792388916016,705.6275024414062,3
NTP Technical Report,10.0,0,0,41.812400817871094,697.97998046875,129.41139221191406,710.0,3
Technical Report 595. November 2018.,10.0,0,0,41.88232421875,721.97998046875,198.22230529785156,734.0,3
8,5.829999923706055,0,0,36.880001068115234,739.1198120117188,39.870792388916016,746.1275024414062,3
NTP Technical Report,10.0,0,0,41.812400817871094,738.47998046875,129.41139221191406,750.5,3
